{"id":"1f132a83-5843-45d1-ae07-f3bd09dbbf73","slug":"willian-lima","firstname":"Willian","surname":"Lima","personType":"real","countryCode":"BR","weightClass":"-66","category":"Judo","stats":{"power":7,"speed":8,"technique":8,"kumikata":7,"newaza":7},"signatureMoveIds":["seoi-nage"],"lastUpdated":"2026-08-26T00:00:00Z","profileUrl":"https://www.ijf.org/news/show/diyora-keldiyorova-makes-history","sourceUrls":["https://www.ijf.org/news/show/diyora-keldiyorova-makes-history"],"bio":"Brazilian half-lightweight Willian Lima won Olympic silver at Paris 2024.","gender":"male","isHidden":false,"rarity":"Rare"}
