{"id":"5e12ad9b-db08-4e41-9423-48a3e91c8f33","slug":"joao-crisostomo","firstname":"João","surname":"Crisóstomo","personType":"real","countryCode":"PT","weightClass":"-66","category":"Judo","stats":{"power":6,"speed":7,"technique":6,"kumikata":7,"newaza":6},"signatureMoveIds":["o-uchi-gari"],"lastUpdated":"2026-08-26T00:00:00Z","profileUrl":"https://www.fpj.pt/noticia/anri-egutidze-e-jorge-fonseca-5o-lugar-grand-slam-de-toquio/","sourceUrls":["https://www.fpj.pt/noticia/anri-egutidze-e-jorge-fonseca-5o-lugar-grand-slam-de-toquio/"],"bio":"Portuguese half-lightweight João Crisóstomo represented Portugal in international senior competition.","gender":"male","isHidden":false,"rarity":"Common"}
