{"id":"524fb114-42d9-46f4-89b1-5eeec5110ef0","slug":"catarina-costa","firstname":"Catarina","surname":"Costa","personType":"real","countryCode":"PT","weightClass":"-48","category":"Judo","stats":{"power":5,"speed":8,"technique":7,"kumikata":6,"newaza":7},"signatureMoveIds":["sumi-gaeshi"],"lastUpdated":"2026-08-26T00:00:00Z","profileUrl":"https://en.wikipedia.org/wiki/Catarina_Costa","sourceUrls":["https://en.wikipedia.org/wiki/Catarina_Costa"],"bio":"Portuguese extra-lightweight Catarina Costa represented Portugal at the Tokyo 2020 Olympic Games.","gender":"female","isHidden":false,"rarity":"Common"}
