{
  "id": "dd9ae2a5-e61f-4929-9e05-05ced4d2395f",
  "slug": "shohei-ono",
  "firstname": "Shohei",
  "surname": "Ono",
  "personType": "real",
  "countryCode": "JP",
  "weightClass": "-73",
  "category": "Judo",
  "stats": { "power": 9, "speed": 9, "technique": 10, "kumikata": 10, "newaza": 8 },
  "signatureMoveIds": ["uchi-mata"],
  "lastUpdated": "2026-08-26T00:00:00Z",
  "profileUrl": "https://en.wikipedia.org/wiki/Shohei_Ono",
  "bio": "Japanese lightweight Shohei Ono is a two-time Olympic champion and three-time world champion.",
  "gender": "male",
  "isHidden": false,
  "rarity": "Legendary"
}
