{
  "id": "550785c5-a415-4c8e-952b-ffaa6cd04f68",
  "slug": "kayla-harrison",
  "firstname": "Kayla",
  "surname": "Harrison",
  "personType": "real",
  "countryCode": "US",
  "weightClass": "-78",
  "category": "Judo",
  "stats": { "power": 10, "speed": 8, "technique": 9, "kumikata": 9, "newaza": 8 },
  "signatureMoveIds": ["uchi-mata"],
  "lastUpdated": "2026-08-26T00:00:00Z",
  "profileUrl": "https://en.wikipedia.org/wiki/Kayla_Harrison",
  "bio": "American half-heavyweight Kayla Harrison won Olympic gold medals in London and Rio.",
  "gender": "female",
  "isHidden": false,
  "rarity": "Legendary"
}
