{"id":"ed4a5c0e-0279-4621-81d4-2e593a913732","slug":"cedric-revol","firstname":"Cédric","surname":"Revol","personType":"real","countryCode":"FR","weightClass":"-60","category":"Judo","stats":{"power":6,"speed":8,"technique":7,"kumikata":6,"newaza":6},"signatureMoveIds":["seoi-otoshi"],"lastUpdated":"2026-08-26T00:00:00Z","profileUrl":"https://en.wikipedia.org/wiki/C%C3%A9dric_Revol","sourceUrls":["https://en.wikipedia.org/wiki/C%C3%A9dric_Revol"],"bio":"French extra-lightweight Cédric Revol has competed for France on the international judo circuit.","gender":"male","isHidden":false,"rarity":"Common"}
