{"id":"a11183a7-f348-479b-8ac5-c26715c93bb6","slug":"bilal-ciloglu","firstname":"Bilal","surname":"Çiloğlu","personType":"real","countryCode":"TR","weightClass":"-73","category":"Judo","stats":{"power":6,"speed":7,"technique":7,"kumikata":6,"newaza":6},"signatureMoveIds":["uchi-mata"],"lastUpdated":"2026-08-26T00:00:00Z","profileUrl":"https://en.wikipedia.org/wiki/Bilal_%C3%87ilo%C4%9Flu","sourceUrls":["https://en.wikipedia.org/wiki/Bilal_%C3%87ilo%C4%9Flu"],"bio":"Turkish lightweight Bilal Çiloğlu has represented Türkiye at Olympic and IJF events.","gender":"male","isHidden":false,"rarity":"Common"}
