{"id":"80883bd7-bb5c-4fc0-95d6-084c61d9e013","slug":"shamil-borchashvili","firstname":"Shamil","surname":"Borchashvili","personType":"real","countryCode":"AT","weightClass":"-81","category":"Judo","stats":{"power":7,"speed":7,"technique":7,"kumikata":8,"newaza":7},"signatureMoveIds":["uchi-mata"],"lastUpdated":"2026-08-26T00:00:00Z","profileUrl":"https://www.ijf.org/news/show/changing-of-the-guard-in-austrian-judo","sourceUrls":["https://www.ijf.org/news/show/changing-of-the-guard-in-austrian-judo"],"bio":"Austrian half-middleweight Shamil Borchashvili won Olympic and world bronze medals.","gender":"male","isHidden":false,"rarity":"Rare"}
