{
  "id": "4de2febb-ec90-4dbc-9019-6f442e965def",
  "slug": "zelim-kotsoiev",
  "firstname": "Zelim",
  "surname": "Kotsoiev",
  "personType": "real",
  "countryCode": "AZ",
  "weightClass": "-100",
  "category": "Judo",
  "stats": { "power": 10, "speed": 8, "technique": 9, "kumikata": 9, "newaza": 7 },
  "signatureMoveIds": ["uchi-mata"],
  "lastUpdated": "2026-08-26T00:00:00Z",
  "profileUrl": "https://en.wikipedia.org/wiki/Zelim_Kotsoiev",
  "bio": "Azerbaijani half-heavyweight Zelim Kotsoiev won Olympic gold at Paris 2024 and has medalled at world championships.",
  "gender": "male",
  "isHidden": false,
  "rarity": "Epic"
}
