{"id":"7c8c031c-d334-4511-b4dd-0cd034b9d0a3","slug":"gusman-kyrgyzbayev","firstname":"Gusman","surname":"Kyrgyzbayev","personType":"real","countryCode":"KZ","weightClass":"-66","category":"Judo","stats":{"power":7,"speed":8,"technique":8,"kumikata":7,"newaza":7},"signatureMoveIds":["seoi-nage"],"lastUpdated":"2026-08-26T00:00:00Z","profileUrl":"https://en.wikipedia.org/wiki/Gusman_Kyrgyzbayev","sourceUrls":["https://en.wikipedia.org/wiki/Gusman_Kyrgyzbayev"],"bio":"Kazakh half-lightweight Gusman Kyrgyzbayev won Olympic bronze at Paris 2024.","gender":"male","isHidden":false,"rarity":"Rare"}
