{"id":"41ecddbd-530b-440d-97af-fe91d935855d","slug":"lubjana-piovesana","firstname":"Lubjana","surname":"Piovesana","personType":"real","countryCode":"AT","weightClass":"-63","category":"Judo","stats":{"power":6,"speed":7,"technique":7,"kumikata":6,"newaza":6},"signatureMoveIds":["uchi-mata"],"lastUpdated":"2026-08-26T00:00:00Z","profileUrl":"https://en.wikipedia.org/wiki/Lubjana_Piovesana","sourceUrls":["https://en.wikipedia.org/wiki/Lubjana_Piovesana"],"bio":"Austrian half-middleweight Lubjana Piovesana represented Austria at the Paris 2024 Olympic Games.","gender":"female","isHidden":false,"rarity":"Common"}
