{
  "id": "b8b148ac-b01a-418a-9c6b-ab4d6f2789b7",
  "slug": "alice-bellandi",
  "firstname": "Alice",
  "surname": "Bellandi",
  "personType": "real",
  "countryCode": "IT",
  "weightClass": "-78",
  "category": "Judo",
  "stats": { "power": 9, "speed": 8, "technique": 9, "kumikata": 9, "newaza": 8 },
  "signatureMoveIds": ["uchi-mata"],
  "lastUpdated": "2026-08-26T00:00:00Z",
  "profileUrl": "https://en.wikipedia.org/wiki/Alice_Bellandi",
  "bio": "Italian half-heavyweight Alice Bellandi won Olympic gold at Paris 2024 after becoming a world championship medallist.",
  "gender": "female",
  "isHidden": false,
  "rarity": "Epic"
}
