{
  "id": "57a86958-73c3-4dd3-b8b8-f0bbaab58b67",
  "slug": "shozo-fujii",
  "firstname": "Shōzō",
  "surname": "Fujii",
  "personType": "real",
  "countryCode": "JP",
  "weightClass": "-81",
  "category": "Judo",
  "stats": {
    "power": 8,
    "speed": 8,
    "technique": 8,
    "kumikata": 7,
    "newaza": 8
  },
  "lastUpdated": "2026-08-14T00:00:00Z",
  "profileUrl": "https://en.wikipedia.org/wiki/Sh%C5%8Dz%C5%8D_Fujii",
  "bio": "Japanese judoka Shōzō Fujii won four consecutive world titles during the 1970s in the divisions now represented by 81 kg.",
  "gender": "male",
  "isHidden": false,
  "rarity": "Legendary",
  "signatureMoveIds": [
    "seoi-nage"
  ],
  "aliases": [
    "Shozo Fujii"
  ]
}
