{
  "id": "b459d97d-83c6-4dee-8789-323bacc6a232",
  "slug": "muzafarbek-turoboyev",
  "firstname": "Muzafarbek",
  "surname": "Turoboyev",
  "personType": "real",
  "countryCode": "UZ",
  "weightClass": "-100",
  "category": "Judo",
  "stats": { "power": 9, "speed": 8, "technique": 9, "kumikata": 9, "newaza": 7 },
  "signatureMoveIds": ["uchi-mata"],
  "lastUpdated": "2026-08-26T00:00:00Z",
  "profileUrl": "https://en.wikipedia.org/wiki/Muzafarbek_Turoboyev",
  "bio": "Uzbek half-heavyweight Muzafarbek Turoboyev won the 2022 world title and competed at the Paris 2024 Olympic Games.",
  "gender": "male",
  "isHidden": false,
  "rarity": "Epic"
}
